id_sdm,nama_dosen,judul_kegiatan,tahun_kegiatan,jenis_kegiatan
e4u0fxTGIXZk6OVg1D7m069hCuRXliun1mKiHaKuuctsYHsZ27ohFYlcf9jNv9rJbQIUIQ==,Atik Wintarti,Pelatihan Informatika untuk Meningkatkan Kompetensi Guru SMA dan SMK di Surabaya,2024,Pengabdian Masyarakat
e4u0fxTGIXZk6OVg1D7m069hCuRXliun1mKiHaKuuctsYHsZ27ohFYlcf9jNv9rJbQIUIQ==,Atik Wintarti,PENGENALAN PEMROGRAMAN UNTUK SISWA SMP SEKOLAH INDONESIA CAIRO (SIC),2023,Pengabdian Masyarakat
e4u0fxTGIXZk6OVg1D7m069hCuRXliun1mKiHaKuuctsYHsZ27ohFYlcf9jNv9rJbQIUIQ==,Atik Wintarti,Pelatihan bagi Guru SMP di Kabupaten Trenggalek,2022,Pengabdian Masyarakat
e4u0fxTGIXZk6OVg1D7m069hCuRXliun1mKiHaKuuctsYHsZ27ohFYlcf9jNv9rJbQIUIQ==,Atik Wintarti,PELATIHAN PENERAPAN KOMPETENSI STRATEGIS  DALAM MEMECAHKAN MASALAH MATEMATIKA BAGI GURU SMP DI KABUPATEN TRENGGALEK,2022,Pengabdian Masyarakat
e4u0fxTGIXZk6OVg1D7m069hCuRXliun1mKiHaKuuctsYHsZ27ohFYlcf9jNv9rJbQIUIQ==,Atik Wintarti,Pelatihan Penerapan Blended Learning Menggunakan Internet of Things Bagi Guru-guru Matematika Kabupaten Jombang,2021,Pengabdian Masyarakat
e4u0fxTGIXZk6OVg1D7m069hCuRXliun1mKiHaKuuctsYHsZ27ohFYlcf9jNv9rJbQIUIQ==,Atik Wintarti,Penerapan Artificial Intelligence untuk Pelarasan Otomatis pada Industri Gamelan di Loceret-Nganjuk Saat Pandemi Covid19,2020,Pengabdian Masyarakat
ug18IBRkRo2_1vVjCnaL2pNGZVIi9vtromIBpKjtE9X1x2pHmT5WyXIHHpgtZjN9gyGe9g==,Siska Puspitaningsih,PELATIHAN PENGGUNAAN AR  BAGI BAPAK/IBU GURU MGMP Se WILAYAH BOJONEGORO,2024,Pengabdian Masyarakat
ug18IBRkRo2_1vVjCnaL2pNGZVIi9vtromIBpKjtE9X1x2pHmT5WyXIHHpgtZjN9gyGe9g==,Siska Puspitaningsih,PELATIHAN PENGGUNAAN APLIKASI PENJUMLAHAN DAN  PENGURANGAN BERSUSUN BERBASIS MOBILE UNTUK ANAK SEKOLAH  DASAR KELAS 1,2023,Pengabdian Masyarakat
ug18IBRkRo2_1vVjCnaL2pNGZVIi9vtromIBpKjtE9X1x2pHmT5WyXIHHpgtZjN9gyGe9g==,Siska Puspitaningsih,PELATIHAN PEMANFAATAN SOFTWARE GEOGEBRA DALAM PEMBELAJARAN MATEMATIKA PADA MATERI PROGRAM LINIER UNTUK SISWA KELAS XI SMAN 1 BALEN BOJONEGORO,2022,Pengabdian Masyarakat
ug18IBRkRo2_1vVjCnaL2pNGZVIi9vtromIBpKjtE9X1x2pHmT5WyXIHHpgtZjN9gyGe9g==,Siska Puspitaningsih,PELATIHAN PENGGUNAAN MEDIA PEMBELAJARAN PADA SISWA PENDIDIKAN SEKOLAH DASAR BERBASIS MOBILE,2022,Pengabdian Masyarakat
XSZZdZfK-0lj0Q0D8ItXeI3YO8eS_s4kerNAxQfMPBwYdGSwG59phJuyammBJnzq6i0q_Q==,Heri Purnawan,Pelatihan PLC Outseal Dan SCADA Haiwell Di SMK Negeri 1 Lamongan,2024,Pengabdian Masyarakat
XSZZdZfK-0lj0Q0D8ItXeI3YO8eS_s4kerNAxQfMPBwYdGSwG59phJuyammBJnzq6i0q_Q==,Heri Purnawan,PEMBERIAN DAN PENANAMAN BIBIT POHON LOMBOK DI DUSUN PUNCEL DESA DEKET WETAN KEC LAMONGAN KAB LAMONGAN,2024,Pengabdian Masyarakat
XSZZdZfK-0lj0Q0D8ItXeI3YO8eS_s4kerNAxQfMPBwYdGSwG59phJuyammBJnzq6i0q_Q==,Heri Purnawan,Pemberian dan penanaman bibit pohon jeruk purut di Desa Priyoso Kecamatan Karangbinangun Kabupaten Lamongan,2023,Pengabdian Masyarakat
XSZZdZfK-0lj0Q0D8ItXeI3YO8eS_s4kerNAxQfMPBwYdGSwG59phJuyammBJnzq6i0q_Q==,Heri Purnawan,Pemberian Dan Penanaman Bibit Pohon Mangga Dan Pupuk Kompos Di RT 6 RW 6 Dusun Puncel Desa Deket Wetan Kecamatan Deket Kabupaten Lamongan,2023,Pengabdian Masyarakat
51rEX5Z49Gjhoqhh3pOnCQ5S2QvV3JYEACF0lOljO1g5quKtkSwAhuNECwAvTIKy97ke8g==,Ibnu Febry Kurniawan,APLIKASI PEMANTAUAN KESEHATAN KELUARGA BERBASIS ANDROID DI PUSKESMAS TERPADU,2025,Pengabdian Masyarakat
51rEX5Z49Gjhoqhh3pOnCQ5S2QvV3JYEACF0lOljO1g5quKtkSwAhuNECwAvTIKy97ke8g==,Ibnu Febry Kurniawan,Pelatihan Informatika untuk Meningkatkan Kompetensi Guru SMA dan SMK di Surabaya,2024,Pengabdian Masyarakat
51rEX5Z49Gjhoqhh3pOnCQ5S2QvV3JYEACF0lOljO1g5quKtkSwAhuNECwAvTIKy97ke8g==,Ibnu Febry Kurniawan,Pemanfaatan Google Apps For Education (GAFE) untuk kolaborasi Onlene antar Guru di SMK Negeri 2 Magetan.,2019,Pengabdian Masyarakat
51rEX5Z49Gjhoqhh3pOnCQ5S2QvV3JYEACF0lOljO1g5quKtkSwAhuNECwAvTIKy97ke8g==,Ibnu Febry Kurniawan,Pemanfaatan Google Apps for Education (GAFE) untuk Kolaborasi Online antar Guru di SMK Negeri 2 Magetan,2019,Pengabdian Masyarakat
51rEX5Z49Gjhoqhh3pOnCQ5S2QvV3JYEACF0lOljO1g5quKtkSwAhuNECwAvTIKy97ke8g==,Ibnu Febry Kurniawan,Pemanfaatan Google Apps for Education untuk Kolaborasi Online antar Guru di SMK Negeri 2 Magetan,2019,Pengabdian Masyarakat
51rEX5Z49Gjhoqhh3pOnCQ5S2QvV3JYEACF0lOljO1g5quKtkSwAhuNECwAvTIKy97ke8g==,Ibnu Febry Kurniawan,Pemanfaatan Google apps for Education (GAFE) untuk kolaborasi online antar guru di SMP Negeri Waru I Sidoarjo ,2018,Pengabdian Masyarakat
51rEX5Z49Gjhoqhh3pOnCQ5S2QvV3JYEACF0lOljO1g5quKtkSwAhuNECwAvTIKy97ke8g==,Ibnu Febry Kurniawan,Pemanfaatan Google Apps for Education untuk kolaborasi online antar guru di SMP Negeri Waru I Sidoarjo,2018,Pengabdian Masyarakat
51rEX5Z49Gjhoqhh3pOnCQ5S2QvV3JYEACF0lOljO1g5quKtkSwAhuNECwAvTIKy97ke8g==,Ibnu Febry Kurniawan,Pemanfaatan Google Apps for Education (GAFE) untuk Kolaborasi Online Antar Guru di SMP Kemala Bhayangkari 8 Surabaya,2017,Pengabdian Masyarakat
51rEX5Z49Gjhoqhh3pOnCQ5S2QvV3JYEACF0lOljO1g5quKtkSwAhuNECwAvTIKy97ke8g==,Ibnu Febry Kurniawan,Pelatihan Pengenalan Scratch untuk Membekali Konsep Berfikir Logis dan Matematis pada Siswa Sekolah Dasar,2016,Pengabdian Masyarakat
51rEX5Z49Gjhoqhh3pOnCQ5S2QvV3JYEACF0lOljO1g5quKtkSwAhuNECwAvTIKy97ke8g==,Ibnu Febry Kurniawan,Pelatihan Pengenalan Scratch untuk Membekali Konsep Berfikir Logis dan Matematis pada Siswa Sekolah Dasar (Studi Kasus pada SD Kyai Ibrahim Surabaya),2016,Pengabdian Masyarakat
51rEX5Z49Gjhoqhh3pOnCQ5S2QvV3JYEACF0lOljO1g5quKtkSwAhuNECwAvTIKy97ke8g==,Ibnu Febry Kurniawan,Pelatihan Pengenalan Scratch untuk Membekali Konsep Berpikir Logis dan Matematis pada Siswa Sekolah Dasar,2016,Pengabdian Masyarakat
51rEX5Z49Gjhoqhh3pOnCQ5S2QvV3JYEACF0lOljO1g5quKtkSwAhuNECwAvTIKy97ke8g==,Ibnu Febry Kurniawan,Pelatihan Pengenalan Bahasa Pemrograman Komputer untuk Meningkatkan Kemampuan Pemecahan Masalah pada Siswa Sekolah Dasar,2015,Pengabdian Masyarakat
PGt25k6rqQshJfmGoStYk8yF1W2TgWV3Gfg8tRkOblCdSmAu3RAPujKWA7h3qivzUgbdTQ==,Ulfa Siti Nuraini,APLIKASI PEMANTAUAN KESEHATAN KELUARGA BERBASIS ANDROID DI PUSKESMAS TERPADU,2025,Pengabdian Masyarakat
PGt25k6rqQshJfmGoStYk8yF1W2TgWV3Gfg8tRkOblCdSmAu3RAPujKWA7h3qivzUgbdTQ==,Ulfa Siti Nuraini,Pelatihan Informatika untuk Meningkatkan Kompetensi Guru SMA dan SMK di Surabaya,2024,Pengabdian Masyarakat
PGt25k6rqQshJfmGoStYk8yF1W2TgWV3Gfg8tRkOblCdSmAu3RAPujKWA7h3qivzUgbdTQ==,Ulfa Siti Nuraini,PENGOLAHAN DAN VISUALISASI DATA SEBAGAI PENUNJANG PENINGKATAN PENDIDIKAN MENGGUNAKAN MICROSOFT EXCEL,2024,Pengabdian Masyarakat
5HLmrZPYpQ7E_bYFJPAMzgtI2hNLPhER5JBmHJ8dB53rVo8F35zyeM5hB0vQQ429BtSSBw==,Yuliani Puji Astuti,APLIKASI PEMANTAUAN KESEHATAN KELUARGA BERBASIS ANDROID DI PUSKESMAS TERPADU,2025,Pengabdian Masyarakat
5HLmrZPYpQ7E_bYFJPAMzgtI2hNLPhER5JBmHJ8dB53rVo8F35zyeM5hB0vQQ429BtSSBw==,Yuliani Puji Astuti,PENGOLAHAN DAN VISUALISASI DATA SEBAGAI PENUNJANG PENINGKATAN PENDIDIKAN MENGGUNAKAN MICROSOFT EXCEL,2024,Pengabdian Masyarakat
5HLmrZPYpQ7E_bYFJPAMzgtI2hNLPhER5JBmHJ8dB53rVo8F35zyeM5hB0vQQ429BtSSBw==,Yuliani Puji Astuti,PELATIHAN PENGUATAN KONTEN MATEMATIKA GURU SEKOLAH INDONESIA CAIRO (SIC) MESIR,2023,Pengabdian Masyarakat
5HLmrZPYpQ7E_bYFJPAMzgtI2hNLPhER5JBmHJ8dB53rVo8F35zyeM5hB0vQQ429BtSSBw==,Yuliani Puji Astuti,Pelatihan Penyusunan Tugas Matematika Berorientasi Kontekstual-Numerasi bagi Guru matematika sd di kabupaten magetan,2023,Pengabdian Masyarakat
5HLmrZPYpQ7E_bYFJPAMzgtI2hNLPhER5JBmHJ8dB53rVo8F35zyeM5hB0vQQ429BtSSBw==,Yuliani Puji Astuti,PENGUATAN KOMPETENSI GURU SD DI KABUPATEN TRENGGALEK DALAM MENUNJANG ASESMEN KOMPETENSI MINIMUM,2022,Pengabdian Masyarakat
5HLmrZPYpQ7E_bYFJPAMzgtI2hNLPhER5JBmHJ8dB53rVo8F35zyeM5hB0vQQ429BtSSBw==,Yuliani Puji Astuti,Pelatihan Mathematica Berbasis CLoud Untuk Pembelejaran Matematika SMP di MTsN Jombang,2021,Pengabdian Masyarakat
5HLmrZPYpQ7E_bYFJPAMzgtI2hNLPhER5JBmHJ8dB53rVo8F35zyeM5hB0vQQ429BtSSBw==,Yuliani Puji Astuti,Pelatihan Model Smart Learning untuk menunjang Pembelajaran Daring pada masa Kenormalan Baru Covid-19 bagi Guru-guru di MGMP Matematika SMP Kabupaten Lumajang,2020,Pengabdian Masyarakat
5HLmrZPYpQ7E_bYFJPAMzgtI2hNLPhER5JBmHJ8dB53rVo8F35zyeM5hB0vQQ429BtSSBw==,Yuliani Puji Astuti,Pelatihan Pemanfaatan Google Apps for Education bagi Guru-guru SMP Calon Peserta Lomba INOBEL di Kabupaten Ponorogo,2019,Pengabdian Masyarakat
5HLmrZPYpQ7E_bYFJPAMzgtI2hNLPhER5JBmHJ8dB53rVo8F35zyeM5hB0vQQ429BtSSBw==,Yuliani Puji Astuti,  Pelatihan Penggunaan Aplikasi jBatik untuk Mendesain Batik Fraktal di MGMP Seni Budaya Kabupaten Tulungagung,2017,Pengabdian Masyarakat
NbLLjtLB7Ln_YpAs_4po4CRVO1LXp0DUNeDwaob3Gv7PcRb86FZHopoaoXPR7SLIPF2y7g==,Yuni Rosita Dewi,EDUKASI MANAJEMEN STRATEGI  PEMASARAN AGROINDUSTRI KOPI DI PAGUYUBAN KOPI BON TUGU,2024,Pengabdian Masyarakat
NbLLjtLB7Ln_YpAs_4po4CRVO1LXp0DUNeDwaob3Gv7PcRb86FZHopoaoXPR7SLIPF2y7g==,Yuni Rosita Dewi,Pelatihan Inovasi Bakso Lele dalam Mendukung Pencegahan Stunting di Desa Pungging,2024,Pengabdian Masyarakat
NbLLjtLB7Ln_YpAs_4po4CRVO1LXp0DUNeDwaob3Gv7PcRb86FZHopoaoXPR7SLIPF2y7g==,Yuni Rosita Dewi,"PENYULUHAN POTENSI BUDIDAYA TANAMAN VANILI (VANILLA PLANIFOLIA) DALAM POLYBAG DI AREA PERKOTAAN PADAT PENDUDUK SEBAGAI PENGHASILAN TAMBAHAN MASYARAKAT DI KELURAHAN SOOKO, KECAMATAN SOOKO, KABUPATEN MOJOKERTO",2024,Pengabdian Masyarakat
NbLLjtLB7Ln_YpAs_4po4CRVO1LXp0DUNeDwaob3Gv7PcRb86FZHopoaoXPR7SLIPF2y7g==,Yuni Rosita Dewi,SOSIALISAI PENINGKATAN NILAI TAMBAH PRODUK  JAMU LOKAL DESA BETRO KECAMATAN KEMLAGI  KABUPATEN MOJOKERTO,2024,Pengabdian Masyarakat
NbLLjtLB7Ln_YpAs_4po4CRVO1LXp0DUNeDwaob3Gv7PcRb86FZHopoaoXPR7SLIPF2y7g==,Yuni Rosita Dewi,Sosialisasi Pembuatan Es  Cincau dari Tanaman Cyclea Barbata Miers untuk Menambah Pendapatan dan  Ketahanan Pangan Mahasiswa.,2024,Pengabdian Masyarakat
NbLLjtLB7Ln_YpAs_4po4CRVO1LXp0DUNeDwaob3Gv7PcRb86FZHopoaoXPR7SLIPF2y7g==,Yuni Rosita Dewi,"Sosialisasi Pendidikan Karakter, Pengelolaan Sampah Dan Praktik Membuat Pot Guna Mendukung Program Adiwiyata di SMPN 2 Dlanggu Kabupaten Mojokerto",2024,Pengabdian Masyarakat
NbLLjtLB7Ln_YpAs_4po4CRVO1LXp0DUNeDwaob3Gv7PcRb86FZHopoaoXPR7SLIPF2y7g==,Yuni Rosita Dewi,SOSIALISASI STANDAR OPERASIONAL PROSEDUR (SOP) TATA KELOLA KEPEGAWAIAN DAN ADMINISTRASI UNTUK MENINGKATKAN  KINERJA PEGAWAI,2024,Pengabdian Masyarakat
NbLLjtLB7Ln_YpAs_4po4CRVO1LXp0DUNeDwaob3Gv7PcRb86FZHopoaoXPR7SLIPF2y7g==,Yuni Rosita Dewi,PEMBUATAN PUPUK ORGANIK CAIR SEBAGAI ALTERNATIF PUPUK RAMAH LINGKUNGAN DI PONDOK PESANTREN AL MUHAJIRIN,2023,Pengabdian Masyarakat
NbLLjtLB7Ln_YpAs_4po4CRVO1LXp0DUNeDwaob3Gv7PcRb86FZHopoaoXPR7SLIPF2y7g==,Yuni Rosita Dewi,PENYULUHAN DAN PELATIHAN PEMBUATAN PESTISIDA BIOINSEKTISIDA RAMAH LINGKUNGAN,2023,Pengabdian Masyarakat
NbLLjtLB7Ln_YpAs_4po4CRVO1LXp0DUNeDwaob3Gv7PcRb86FZHopoaoXPR7SLIPF2y7g==,Yuni Rosita Dewi,SOSIALISASI 3R DALAM KEHIDUPAN SEHARI-HARI DI SEKOLAH,2023,Pengabdian Masyarakat
NbLLjtLB7Ln_YpAs_4po4CRVO1LXp0DUNeDwaob3Gv7PcRb86FZHopoaoXPR7SLIPF2y7g==,Yuni Rosita Dewi,PEMBUATAN MEDIA TANAM INOVATIF DARI BAHAN YANG BELUM TERMANFAATKAN,2022,Pengabdian Masyarakat
NbLLjtLB7Ln_YpAs_4po4CRVO1LXp0DUNeDwaob3Gv7PcRb86FZHopoaoXPR7SLIPF2y7g==,Yuni Rosita Dewi,Pendampingan Greenhouse Reborn untuk Balongmojo Lestari,2022,Pengabdian Masyarakat
v_4c32wb5hIIDHOu-H1Q9r4E3E-jU0rQEn0ECvOTdVuqj7pb8oH0UvoR5Px5Ax0ROQO7zg==,Hasanuddin Al-habib,APLIKASI PEMANTAUAN KESEHATAN KELUARGA BERBASIS ANDROID DI PUSKESMAS TERPADU,2025,Pengabdian Masyarakat
v_4c32wb5hIIDHOu-H1Q9r4E3E-jU0rQEn0ECvOTdVuqj7pb8oH0UvoR5Px5Ax0ROQO7zg==,Hasanuddin Al-habib,PENGOLAHAN DAN VISUALISASI DATA SEBAGAI PENUNJANG PENINGKATAN PENDIDIKAN MENGGUNAKAN MICROSOFT EXCEL,2024,Pengabdian Masyarakat
v_4c32wb5hIIDHOu-H1Q9r4E3E-jU0rQEn0ECvOTdVuqj7pb8oH0UvoR5Px5Ax0ROQO7zg==,Hasanuddin Al-habib,PENGENALAN PEMROGRAMAN UNTUK SISWA SMP SEKOLAH INDONESIA CAIRO (SIC),2023,Pengabdian Masyarakat
_W4OJWWYOUiHUaYpihPLVaISoSH-l_YBZuG6unIz9fWXpjCnfufHp1UqvfDBtVnNFIBthg==,Moh. Khoridatul Huda,Arabic and English Course (AEC),2024,Pengabdian Masyarakat
_W4OJWWYOUiHUaYpihPLVaISoSH-l_YBZuG6unIz9fWXpjCnfufHp1UqvfDBtVnNFIBthg==,Moh. Khoridatul Huda,Peningkatan Kualitas Hidup Masyarakat Desa Sukoharjo Melalui Edukasi Kesehatan dan Sanitasi,2024,Pengabdian Masyarakat
_W4OJWWYOUiHUaYpihPLVaISoSH-l_YBZuG6unIz9fWXpjCnfufHp1UqvfDBtVnNFIBthg==,Moh. Khoridatul Huda,Pelatihan Pemanfaatan  Gamifikasi dalam Pembelajaran Bagi  Guru SD di Desa Gombang,2023,Pengabdian Masyarakat
_W4OJWWYOUiHUaYpihPLVaISoSH-l_YBZuG6unIz9fWXpjCnfufHp1UqvfDBtVnNFIBthg==,Moh. Khoridatul Huda,Pengelola Prosiding ISIEP,2023,Pengabdian Masyarakat
_W4OJWWYOUiHUaYpihPLVaISoSH-l_YBZuG6unIz9fWXpjCnfufHp1UqvfDBtVnNFIBthg==,Moh. Khoridatul Huda,Sosialisasi Rancang LKPD dengan Mudah Menggunakan Artificial Intelligence (AI),2023,Pengabdian Masyarakat
_W4OJWWYOUiHUaYpihPLVaISoSH-l_YBZuG6unIz9fWXpjCnfufHp1UqvfDBtVnNFIBthg==,Moh. Khoridatul Huda,Tim Reviewer Jurnal Nasional Cendekia,2023,Pengabdian Masyarakat
4JMXdUpnYm1sYlXHSBuCoXX-8kHmWlwYTwNsdGxdpwPUV47GZKYoq6m4wk6sDm5vssegGQ==,Harmon Prayogi,APLIKASI PEMANTAUAN KESEHATAN KELUARGA BERBASIS ANDROID DI PUSKESMAS TERPADU,2025,Pengabdian Masyarakat
4JMXdUpnYm1sYlXHSBuCoXX-8kHmWlwYTwNsdGxdpwPUV47GZKYoq6m4wk6sDm5vssegGQ==,Harmon Prayogi,Pelatihan Informatika untuk Meningkatkan Kompetensi Guru SMA dan SMK di Surabaya,2024,Pengabdian Masyarakat
4JMXdUpnYm1sYlXHSBuCoXX-8kHmWlwYTwNsdGxdpwPUV47GZKYoq6m4wk6sDm5vssegGQ==,Harmon Prayogi,PENGOLAHAN DAN VISUALISASI DATA SEBAGAI PENUNJANG PENINGKATAN PENDIDIKAN MENGGUNAKAN MICROSOFT EXCEL,2024,Pengabdian Masyarakat
Tdfh-blME-mNLjW0B24k3uDVHJaz8OuZTyeQW6LZd6jiufZnnhwyP8m7HldV8pb3lvITMQ==,Ike Fitriyaningsih,Juri Lomba Inovasi Pembelajaran untuk Guru-Guru SD dan SMP,2023,Pengabdian Masyarakat
Tdfh-blME-mNLjW0B24k3uDVHJaz8OuZTyeQW6LZd6jiufZnnhwyP8m7HldV8pb3lvITMQ==,Ike Fitriyaningsih,PELATIHAN METODE ILMIAH DAN ANALISIS STATISTIKA UNTUK SISWA  SMKS ARJUNA,2023,Pengabdian Masyarakat
Tdfh-blME-mNLjW0B24k3uDVHJaz8OuZTyeQW6LZd6jiufZnnhwyP8m7HldV8pb3lvITMQ==,Ike Fitriyaningsih,Pelatihan Metode Ilmiah dan Analisis Statistika untuk Siswa SMKS Arjuna,2023,Pengabdian Masyarakat
Tdfh-blME-mNLjW0B24k3uDVHJaz8OuZTyeQW6LZd6jiufZnnhwyP8m7HldV8pb3lvITMQ==,Ike Fitriyaningsih,Del Mathematics and Science Competition Tahun 2019,2019,Pengabdian Masyarakat
Tdfh-blME-mNLjW0B24k3uDVHJaz8OuZTyeQW6LZd6jiufZnnhwyP8m7HldV8pb3lvITMQ==,Ike Fitriyaningsih,Pelatihan dan Lomba Statistika Programming untuk Siswa SMA,2019,Pengabdian Masyarakat
Tdfh-blME-mNLjW0B24k3uDVHJaz8OuZTyeQW6LZd6jiufZnnhwyP8m7HldV8pb3lvITMQ==,Ike Fitriyaningsih,Pelatihan Pemanfaatan Teknologi Informasi dan Komunikasi Bagi Perangkat Desa se-Kabupaten Toba Samosir Tahun 2017,2017,Pengabdian Masyarakat
BwFljrhxYaWFKwoRnpYmMV5JuL9-KpXE4UJu00zlZj3W1n4Mx7aJO-LHBdgBhjDwxSeNfw==,Fadhilah Qalbi Annisa,APLIKASI PEMANTAUAN KESEHATAN KELUARGA BERBASIS ANDROID DI PUSKESMAS TERPADU,2025,Pengabdian Masyarakat
BwFljrhxYaWFKwoRnpYmMV5JuL9-KpXE4UJu00zlZj3W1n4Mx7aJO-LHBdgBhjDwxSeNfw==,Fadhilah Qalbi Annisa,Pelatihan Informatika untuk Meningkatkan Kompetensi Guru SMA dan SMK di Surabaya,2024,Pengabdian Masyarakat
BwFljrhxYaWFKwoRnpYmMV5JuL9-KpXE4UJu00zlZj3W1n4Mx7aJO-LHBdgBhjDwxSeNfw==,Fadhilah Qalbi Annisa,PENGOLAHAN DAN VISUALISASI DATA SEBAGAI PENUNJANG PENINGKATAN PENDIDIKAN MENGGUNAKAN MICROSOFT EXCEL,2024,Pengabdian Masyarakat
BwFljrhxYaWFKwoRnpYmMV5JuL9-KpXE4UJu00zlZj3W1n4Mx7aJO-LHBdgBhjDwxSeNfw==,Fadhilah Qalbi Annisa,Program Persiapan Pendidikan Inklusi: Penguatan Pembelajaran Berbasis Keragaman,2024,Pengabdian Masyarakat
BwFljrhxYaWFKwoRnpYmMV5JuL9-KpXE4UJu00zlZj3W1n4Mx7aJO-LHBdgBhjDwxSeNfw==,Fadhilah Qalbi Annisa,PENGENALAN PEMROGRAMAN UNTUK SISWA SMP SEKOLAH INDONESIA CAIRO (SIC),2023,Pengabdian Masyarakat
ONC_ZfBEFBDFmSOzx8wQ7Ov1smqIwFjfAXpzECmPtm4TzH8BV4w9BTLiF5TeTgPe4SlDTg==,Elly Matul Imah,Pelatihan Informatika untuk Meningkatkan Kompetensi Guru SMA dan SMK di Surabaya,2024,Pengabdian Masyarakat
ONC_ZfBEFBDFmSOzx8wQ7Ov1smqIwFjfAXpzECmPtm4TzH8BV4w9BTLiF5TeTgPe4SlDTg==,Elly Matul Imah,PENGENALAN PEMROGRAMAN UNTUK SISWA SMP SEKOLAH INDONESIA CAIRO (SIC),2023,Pengabdian Masyarakat
ONC_ZfBEFBDFmSOzx8wQ7Ov1smqIwFjfAXpzECmPtm4TzH8BV4w9BTLiF5TeTgPe4SlDTg==,Elly Matul Imah,Pelatihan Penulisan Karya Ilmiah dan Analisis Data Bagi Guru di SMA Negeri 1 Kampak,2022,Pengabdian Masyarakat
ONC_ZfBEFBDFmSOzx8wQ7Ov1smqIwFjfAXpzECmPtm4TzH8BV4w9BTLiF5TeTgPe4SlDTg==,Elly Matul Imah,Pelatihan Penerapan Blended Learning Menggunakan Internet of Things Bagi Guru-guru Matematika Kabupaten Jombang,2021,Pengabdian Masyarakat
ONC_ZfBEFBDFmSOzx8wQ7Ov1smqIwFjfAXpzECmPtm4TzH8BV4w9BTLiF5TeTgPe4SlDTg==,Elly Matul Imah,Pelatihan Pendamping Olimpiade Matematika Tingkat SD untuk Materi Aljabar bagi Guru-guru di Kabupaten Kediri,2018,Pengabdian Masyarakat
ONC_ZfBEFBDFmSOzx8wQ7Ov1smqIwFjfAXpzECmPtm4TzH8BV4w9BTLiF5TeTgPe4SlDTg==,Elly Matul Imah,  Pelatihan Penggunaan Aplikasi jBatik untuk Mendesain Batik Fraktal di MGMP Seni Budaya Kabupaten Tulungagung,2017,Pengabdian Masyarakat
_ZfGMf3GbkLUBd12FIZR9OJci8p0ZzpQv7JRTzSorUzkyG0zaLyLEwiVJ97-Y7u1oNIUjg==,Riskyana Dewi Intan Puspitasari,APLIKASI PEMANTAUAN KESEHATAN KELUARGA BERBASIS ANDROID DI PUSKESMAS TERPADU,2025,Pengabdian Masyarakat
_ZfGMf3GbkLUBd12FIZR9OJci8p0ZzpQv7JRTzSorUzkyG0zaLyLEwiVJ97-Y7u1oNIUjg==,Riskyana Dewi Intan Puspitasari,PENGOLAHAN DAN VISUALISASI DATA SEBAGAI PENUNJANG PENINGKATAN PENDIDIKAN MENGGUNAKAN MICROSOFT EXCEL,2024,Pengabdian Masyarakat
_ZfGMf3GbkLUBd12FIZR9OJci8p0ZzpQv7JRTzSorUzkyG0zaLyLEwiVJ97-Y7u1oNIUjg==,Riskyana Dewi Intan Puspitasari,PENGENALAN PEMROGRAMAN UNTUK SISWA SMP SEKOLAH INDONESIA CAIRO (SIC),2023,Pengabdian Masyarakat
96KWu3CRLeoYNWPiSEPy6BNedjzlSWFk5y5LQ_9wJ_rjCIbDRDoI1cnKCQTD0BVrH9tFtg==,Ibrohim,Penguatan Literasi Digital dan Teknologi Informasi untuk Mendukung Penulisan Karya Ilmiah Bagi Perhimpunan Pelajar Indonesia di Malaysia,2025,Pengabdian Masyarakat
96KWu3CRLeoYNWPiSEPy6BNedjzlSWFk5y5LQ_9wJ_rjCIbDRDoI1cnKCQTD0BVrH9tFtg==,Ibrohim,Kemampuan Berpikir Kritis dan Kolaboratif Siswa SMK Ketintang Surabaya Pada Bidang Sensor dan Aktuator,2023,Pengabdian Masyarakat
96KWu3CRLeoYNWPiSEPy6BNedjzlSWFk5y5LQ_9wJ_rjCIbDRDoI1cnKCQTD0BVrH9tFtg==,Ibrohim,"Pengenalan Aplikasi simulasi Arduino berbasis web ""Tinkercad"" sebagai media peningkatan kompetensi dalam perancangan sistem elektronik dan robotika di SMK Magetan 1 YKP Magetan",2022,Pengabdian Masyarakat
96KWu3CRLeoYNWPiSEPy6BNedjzlSWFk5y5LQ_9wJ_rjCIbDRDoI1cnKCQTD0BVrH9tFtg==,Ibrohim,PEMBUATAN HANDSANITIZER OTOMATIS BERBASIS MIKROKONTROLLER SEBAGAI UPAYA PENCEGAHAN PENYEBARAN VIRUS COVID-19,2020,Pengabdian Masyarakat
96KWu3CRLeoYNWPiSEPy6BNedjzlSWFk5y5LQ_9wJ_rjCIbDRDoI1cnKCQTD0BVrH9tFtg==,Ibrohim,upaya meningkatkan ketrampilan pemrograman PLC bagi siswa SMK PGRI 1 magetan sebagai persiapan lomba kompetensi siswa tingkat jawatimur,2019,Pengabdian Masyarakat
96KWu3CRLeoYNWPiSEPy6BNedjzlSWFk5y5LQ_9wJ_rjCIbDRDoI1cnKCQTD0BVrH9tFtg==,Ibrohim,IbM UKM JASA LAUNDRY DAN DRY CLEAN,2017,Pengabdian Masyarakat
96KWu3CRLeoYNWPiSEPy6BNedjzlSWFk5y5LQ_9wJ_rjCIbDRDoI1cnKCQTD0BVrH9tFtg==,Ibrohim,Peningkatan Keterampilan Perbaikan Alat Listrik Rumah Tangga Pemuda Karang Taruna.,2017,Pengabdian Masyarakat
96KWu3CRLeoYNWPiSEPy6BNedjzlSWFk5y5LQ_9wJ_rjCIbDRDoI1cnKCQTD0BVrH9tFtg==,Ibrohim,Pelatihan Robotika untuk Menunjang Kompetensi Inti dan Kompetensi Dasar bagi Siswa SMK Negeri 5 program Keahlian Teknik Elektronika danTeknik Ketenagalistrikan di Kota Surabaya,2016,Pengabdian Masyarakat
izY4eiMWLbW7S9don2_Y8qK80LIMVhGfq3xnQMBfJPTPtqg2n9emxL_8J64qLXr4NirASg==,Nurhayati,PELATIHAN PENYUSUNAN STATE OF THE ART ARTIKEL ILMIAH  DENGAN GENERATIVE AI UNTUK GURU SMA/SMK,2024,Pengabdian Masyarakat
izY4eiMWLbW7S9don2_Y8qK80LIMVhGfq3xnQMBfJPTPtqg2n9emxL_8J64qLXr4NirASg==,Nurhayati,Pemanfaatan Teknologi dalam Pengelolaan Pendidikan dan Pembalajaran Digital di Lembaga Pendidikan Maarif NU Randegansari,2024,Pengabdian Masyarakat
izY4eiMWLbW7S9don2_Y8qK80LIMVhGfq3xnQMBfJPTPtqg2n9emxL_8J64qLXr4NirASg==,Nurhayati,Pengembangan Trainer Panel Surya untuk Meningkatkan Psikomotorik Mahasiswa Pada Mata Kuliah Konversi Tenaga Listrik di Universitas Muhammadiyah Jember,2024,Pengabdian Masyarakat
izY4eiMWLbW7S9don2_Y8qK80LIMVhGfq3xnQMBfJPTPtqg2n9emxL_8J64qLXr4NirASg==,Nurhayati,PENGUATAN KEBUGARAN JASMANI DAN TATA RIAS WAJAH PEKERJA MIGRAN INDONESIA DI LUAR NEGERI,2024,Pengabdian Masyarakat
izY4eiMWLbW7S9don2_Y8qK80LIMVhGfq3xnQMBfJPTPtqg2n9emxL_8J64qLXr4NirASg==,Nurhayati,PENINGKATAN SOFT SKILL MELALUI WORKSHOP PEMANFAATAN ENERGI RENEWABLE BERBASIS ARTIFICIAL INTELLIGENCE BAGI PELAJAR DAN MASYARAKAT DI MANILA,2024,Pengabdian Masyarakat
izY4eiMWLbW7S9don2_Y8qK80LIMVhGfq3xnQMBfJPTPtqg2n9emxL_8J64qLXr4NirASg==,Nurhayati,"PKM Peningkatan produktivitas UMKM Kerupuk Lempeng  Bunga Gading di Desa Tambakmas, Sukomoro Magetan  menggunakan Alat pengering Kerupuk berbahan Bakar Gas ",2024,Pengabdian Masyarakat
izY4eiMWLbW7S9don2_Y8qK80LIMVhGfq3xnQMBfJPTPtqg2n9emxL_8J64qLXr4NirASg==,Nurhayati,"PKM Peningkatan produktivitas UMKM Kerupuk Lempeng Bunga Gading di Desa Tambakmas, Sukomoro Magetan menggunakan Alat pengering Kerupuk berbahan Bakar Gas",2024,Pengabdian Masyarakat
izY4eiMWLbW7S9don2_Y8qK80LIMVhGfq3xnQMBfJPTPtqg2n9emxL_8J64qLXr4NirASg==,Nurhayati,Optimalisasi Literasi dan Akademik Bagi Guru Indonesia di Sekolah Indonesia pada Luar Negeri,2023,Pengabdian Masyarakat
izY4eiMWLbW7S9don2_Y8qK80LIMVhGfq3xnQMBfJPTPtqg2n9emxL_8J64qLXr4NirASg==,Nurhayati,Pelatihan Peningkatan Kompetensi Siswa Pada mata Pelajaran  Pemeliharaan Kelistrikan Kendaraan Ringan Menggunakan Trainer Car  Audio System pada Siswa SMK 1 YKP Magetan ,2023,Pengabdian Masyarakat
izY4eiMWLbW7S9don2_Y8qK80LIMVhGfq3xnQMBfJPTPtqg2n9emxL_8J64qLXr4NirASg==,Nurhayati,"PELATIHAN PRODUK HALAL, MANAGEMEN USAHA DAN OPTIMALISASI PRODUK MELALUI PENERAPAN TEKNOLOGI DI UMKM ROTI DAN KUE DI DESA TAMANARUM MAGETAN",2023,Pengabdian Masyarakat
izY4eiMWLbW7S9don2_Y8qK80LIMVhGfq3xnQMBfJPTPtqg2n9emxL_8J64qLXr4NirASg==,Nurhayati,Pemanfaatan ChatGPT sebagai Media Pembelajaran Inovatif,2023,Pengabdian Masyarakat
izY4eiMWLbW7S9don2_Y8qK80LIMVhGfq3xnQMBfJPTPtqg2n9emxL_8J64qLXr4NirASg==,Nurhayati,Pengembangan Alat Ukur The Alacrity Sebagai Pengukur Kelincahan Berbasis Sensor,2023,Pengabdian Masyarakat
izY4eiMWLbW7S9don2_Y8qK80LIMVhGfq3xnQMBfJPTPtqg2n9emxL_8J64qLXr4NirASg==,Nurhayati,"PKM Peningkatan produktivitas UMKM Kerupuk Lempeng  Bunga Gading di Desa Tambakmas, Sukomoro Magetan  menggunakan Alat pengering Kerupuk berbahan Bakar Gas",2023,Pengabdian Masyarakat
izY4eiMWLbW7S9don2_Y8qK80LIMVhGfq3xnQMBfJPTPtqg2n9emxL_8J64qLXr4NirASg==,Nurhayati,Diseminasi Teknologi Spray Dryer Powder berbasis Photovoltaic dan Digital Marketing dalam upaya peningkatan produktivitas IKM Jamu Djampie di desa Ngariboyo Kabupaten Magetan di masa Pandemic COVID-19,2022,Pengabdian Masyarakat
izY4eiMWLbW7S9don2_Y8qK80LIMVhGfq3xnQMBfJPTPtqg2n9emxL_8J64qLXr4NirASg==,Nurhayati,Pelatihan Penyusunan Proposal Penelitian dan Artikel Hasil Penelitian Bagi Guru-Guru SMK di Magetan,2022,Pengabdian Masyarakat
izY4eiMWLbW7S9don2_Y8qK80LIMVhGfq3xnQMBfJPTPtqg2n9emxL_8J64qLXr4NirASg==,Nurhayati,SOSIALISASI PENGGUNAAN ENERGI TERBARUKAN PEMBANGKIT ENERGI MATAHARI MENGGUNAKAN AI DI KAB MOJOKERTO,2022,Pengabdian Masyarakat
izY4eiMWLbW7S9don2_Y8qK80LIMVhGfq3xnQMBfJPTPtqg2n9emxL_8J64qLXr4NirASg==,Nurhayati,Sosialisasi Penggunaan Teknologi Energi Terbarukan Pembangkit Listrik Tenaga Matahari Berbasis Artificial Intellegence,2022,Pengabdian Masyarakat
izY4eiMWLbW7S9don2_Y8qK80LIMVhGfq3xnQMBfJPTPtqg2n9emxL_8J64qLXr4NirASg==,Nurhayati,Upaya Meningkatkan Kompetensi Pemrograman PLC dan Aplikasinya bagi Siswa SMK Magetan I YKP Magetan ,2022,Pengabdian Masyarakat
izY4eiMWLbW7S9don2_Y8qK80LIMVhGfq3xnQMBfJPTPtqg2n9emxL_8J64qLXr4NirASg==,Nurhayati,Pemanfaatn Teknologi Informasi dalam Upaya Peningkatan Aksesibilitas UMKM di Tempat Wisata di Magetan,2021,Pengabdian Masyarakat
izY4eiMWLbW7S9don2_Y8qK80LIMVhGfq3xnQMBfJPTPtqg2n9emxL_8J64qLXr4NirASg==,Nurhayati,Pemberdayaan Perempuan Melalui Usaha Home Industri Sabun  Di Desa Sidokare Kabupaten Nganjuk,2021,Pengabdian Masyarakat
izY4eiMWLbW7S9don2_Y8qK80LIMVhGfq3xnQMBfJPTPtqg2n9emxL_8J64qLXr4NirASg==,Nurhayati,"Pembuatan aplikasi 360 bersama dinas Pariwisata untuk mengenalkan pariwisata, promosi kuliner, kerajinan masyarakat magetan",2021,Pengabdian Masyarakat
izY4eiMWLbW7S9don2_Y8qK80LIMVhGfq3xnQMBfJPTPtqg2n9emxL_8J64qLXr4NirASg==,Nurhayati,Upaya Meningkatkan Pemahaman IoT melalui Smarthome Berbasis Voice Recognition Bagi Siswa SMKN 1 Probolinggo,2021,Pengabdian Masyarakat
U0qxF5-eSwarCi0KXRSuhnCioUsHSTRG7E543G-RFh11cO52rpAOrxufeLNb_cQKNb4iew==,Endryansyah,PENGABDIAN KEPADA MASYARAKAT PELATIHAN PENULISAN KARYA ILMIAH BEREPUTASI BAGI GURU DI SMK NEGERI 2 BANGKALAN,2024,Pengabdian Masyarakat
U0qxF5-eSwarCi0KXRSuhnCioUsHSTRG7E543G-RFh11cO52rpAOrxufeLNb_cQKNb4iew==,Endryansyah,PELATIHAN PLC TINGKAT MENENGAH UNTUK MENAMBAH KETRAMPILAN PERANCANGAN SISTEM OTOMASI INDUSTRI BAGI MAHASISWA TEKNIK ELEKTRO UNESA,2023,Pengabdian Masyarakat
U0qxF5-eSwarCi0KXRSuhnCioUsHSTRG7E543G-RFh11cO52rpAOrxufeLNb_cQKNb4iew==,Endryansyah,Pengabdian Kepada Masyarakat Pelatihan Penulisan Karya Ilmiah Bereputasi di MAN Sidoarjo,2023,Pengabdian Masyarakat
U0qxF5-eSwarCi0KXRSuhnCioUsHSTRG7E543G-RFh11cO52rpAOrxufeLNb_cQKNb4iew==,Endryansyah,PELATIHAN DASAR TEKNIK MENGGAMBAR MENGGUNAKAN COMPUTER AIDED DESIGN AND DRAFTER BERBASIS AUTOCAD SECARA DARING UNTUK MENGATASI KENDALA PADA MASA PANDEMI COVID-19,2021,Pengabdian Masyarakat
U0qxF5-eSwarCi0KXRSuhnCioUsHSTRG7E543G-RFh11cO52rpAOrxufeLNb_cQKNb4iew==,Endryansyah,PENERAPAN LITERASI DIGITAL UNTUK  MENINGKATKAN KETERAMPILAN MAHASISWA  TEKNIK ELEKTRO UNIVERSITAS HASYIM ASYâ€™ARI JOMBANG,2021,Pengabdian Masyarakat
U0qxF5-eSwarCi0KXRSuhnCioUsHSTRG7E543G-RFh11cO52rpAOrxufeLNb_cQKNb4iew==,Endryansyah,Pengabdian Kepada Masyarakat 2020 Kebijakan FT,2020,Pengabdian Masyarakat
U0qxF5-eSwarCi0KXRSuhnCioUsHSTRG7E543G-RFh11cO52rpAOrxufeLNb_cQKNb4iew==,Endryansyah,Pelatihan Pegembangan Perangkat Pembelajaran Level HOTS Bagi Guru SMK,2019,Pengabdian Masyarakat
